{
  "$schema":"https://json-schema.org/draft/2020-12/schema","title":"Penumbra workload registry","type":"object","additionalProperties":false,
  "required":["version","report_contract","required_report_fields","records"],"properties":{"$schema":{"type":"string"},"version":{"const":"0.5"},"report_contract":{"const":"penumbra-benchmark-report-v0.5"},"required_report_fields":{"type":"array","minItems":38,"uniqueItems":true,"items":{"type":"string"}},"records":{"type":"array","minItems":16,"maxItems":16,"items":{"type":"object","additionalProperties":false,"required":["id","title","status","calibration","availability","report_contract","purpose"],"properties":{"id":{"type":"string","pattern":"^PEN-B(0[1-9]|1[0-6])$"},"title":{"type":"string","minLength":1},"status":{"const":"DefinitionOnly"},"calibration":{"const":"Uncalibrated"},"availability":{"enum":["Planned","DeferredUntilXR"]},"report_contract":{"const":"penumbra-benchmark-report-v0.5"},"purpose":{"type":"string","minLength":10},"privacy":{"type":"string"}}}}}
}
