{
  "$schema": "../../schemas/governance/workloads.schema.json",
  "version":"0.5",
  "report_contract": "penumbra-benchmark-report-v0.5",
  "required_report_fields": [
    "hardware","operating_system","backend","driver","renderer_path","capability_profile","settings","resolution","upscaler","cpu_time_distribution","gpu_time_distribution","frame_time_lows","memory","shader_stalls","pipeline_stalls","upload_stalls","streaming_stalls","resource_churn","overdraw","shadow_cost","volumetric_cost","temporal_stability","device_bottlenecks","visual_differences","artifacts","missing_features","warmup_state","cache_state","source_checkpoint","build_id","corpus_hash","build_hash","alluvium_recipe_hashes","alluvium_version","determinism_level","evaluation_mode","provenance_manifest_hash","raw_evidence"
  ],
  "records": [
    {"id":"PEN-B01","title":"Midnight forest","status":"DefinitionOnly","calibration":"Uncalibrated","availability":"Planned","report_contract":"penumbra-benchmark-report-v0.5","purpose":"Night forest traversal, flashlight, foliage, fog, shadows, streaming, pacing, and temporal stability.","privacy":"Generated or private-hash-referenced; no proprietary route payload."},
    {"id":"PEN-B02","title":"Dense grass field","status":"DefinitionOnly","calibration":"Uncalibrated","availability":"Planned","report_contract":"penumbra-benchmark-report-v0.5","purpose":"Grass density, horizon, LOD, overdraw, wind, shadow policy, streaming, and temporal stability.","privacy":"Generated deterministic corpus."},
    {"id":"PEN-B03","title":"Flashlight through alpha-tested foliage","status":"DefinitionOnly","calibration":"Uncalibrated","availability":"Planned","report_contract":"penumbra-benchmark-report-v0.5","purpose":"Alpha testing, local light, shadow stability, overdraw, and temporal artifacts."},
    {"id":"PEN-B04","title":"Redacted AMI interior with many local lights","status":"DefinitionOnly","calibration":"Uncalibrated","availability":"Planned","report_contract":"penumbra-benchmark-report-v0.5","purpose":"Connected generated interiors, mixed practical temperatures, many shadowed local lights, partial failures, varied materials, decals/transparency, and indoor/outdoor streaming.","privacy":"No logos, documents, narrative text, route data, or proprietary assets; private authority represented only by redacted source hash."},
    {"id":"PEN-B05","title":"Heavy Isobar storm","status":"DefinitionOnly","calibration":"Uncalibrated","availability":"Planned","report_contract":"penumbra-benchmark-report-v0.5","purpose":"Wind, precipitation, fog, volumetrics, wetness hooks, vegetation coupling, stability, and downgrade tiers."},
    {"id":"PEN-B06","title":"Large Basalt terrain vista","status":"DefinitionOnly","calibration":"Uncalibrated","availability":"Planned","report_contract":"penumbra-benchmark-report-v0.5","purpose":"Large-world precision, terrain LOD, geometry residency, streaming, shadows, atmosphere, and memory."},
    {"id":"PEN-B07","title":"Torsant fire, fluids, heat, and smoke","status":"DefinitionOnly","calibration":"Uncalibrated","availability":"Planned","report_contract":"penumbra-benchmark-report-v0.5","purpose":"Optional solver fields, rendering integration, coupling, stability, memory, downgrade, and disabled cost."},
    {"id":"PEN-B08","title":"Rapid camera rotation","status":"DefinitionOnly","calibration":"Uncalibrated","availability":"Planned","report_contract":"penumbra-benchmark-report-v0.5","purpose":"Visibility churn, temporal rejection, disocclusion, streaming prediction, and input-to-frame stability."},
    {"id":"PEN-B09","title":"High-speed traversal","status":"DefinitionOnly","calibration":"Uncalibrated","availability":"Planned","report_contract":"penumbra-benchmark-report-v0.5","purpose":"Streaming deadlines, visibility, LOD, uploads, temporal response, and frame pacing."},
    {"id":"PEN-B10","title":"Large world-streaming transition","status":"DefinitionOnly","calibration":"Uncalibrated","availability":"Planned","report_contract":"penumbra-benchmark-report-v0.5","purpose":"Cell/room transition, IO, decode, upload, activation, residency, memory, and recovery."},
    {"id":"PEN-B11","title":"Low-memory stress","status":"DefinitionOnly","calibration":"Uncalibrated","availability":"Planned","report_contract":"penumbra-benchmark-report-v0.5","purpose":"Unified/discrete memory pressure, eviction, fallback ordering, churn, recovery, and required-content preservation."},
    {"id":"PEN-B12","title":"Shader and pipeline compilation stress","status":"DefinitionOnly","calibration":"Uncalibrated","availability":"Planned","report_contract":"penumbra-benchmark-report-v0.5","purpose":"Shader/material diversity, compile latency, cache identity, warmup, runtime creation, and diagnostics."},
    {"id":"PEN-B13","title":"Shadow-heavy scene","status":"DefinitionOnly","calibration":"Uncalibrated","availability":"Planned","report_contract":"penumbra-benchmark-report-v0.5","purpose":"Directional/local shadow casters, cache/update policy, memory, aliasing, and stability."},
    {"id":"PEN-B14","title":"Transparency-heavy scene","status":"DefinitionOnly","calibration":"Uncalibrated","availability":"Planned","report_contract":"penumbra-benchmark-report-v0.5","purpose":"Transparency sorting/blending, alpha overdraw, particles/decals, light interaction, and lower-tier policy."},
    {"id":"PEN-B15","title":"Temporal-disocclusion test","status":"DefinitionOnly","calibration":"Uncalibrated","availability":"Planned","report_contract":"penumbra-benchmark-report-v0.5","purpose":"History validity, motion, exposure, disocclusion, ghosting, shimmer, and temporal-debug evidence."},
    {"id":"PEN-B16","title":"VR-oriented stereo test","status":"DefinitionOnly","calibration":"Uncalibrated","availability":"DeferredUntilXR","report_contract":"penumbra-benchmark-report-v0.5","purpose":"Stereo consistency, multiview, foveation, predicted timing, late pose, memory, and comfort."}
  ]
}
